{
  "schema_version": "1.1",
  "case_id": "synthetic-case",
  "expected_behavior": {
    "vulnerable": "Synthetic vulnerable behavior",
    "fixed": "Synthetic fixed behavior"
  },
  "expected_mechanisms": [
    {
      "mechanism_id": "mechanism-synthetic",
      "description": "Synthetic expected mechanism",
      "adjudication_rubric": "Match only the synthetic mechanism"
    }
  ],
  "acceptable_locations": [
    {
      "path": "src/example.py",
      "aliases": ["legacy/example.py"],
      "start_line": 4,
      "end_line": 8
    }
  ],
  "accepted_defect_categories": ["correctness", "operational_contract"],
  "severity_range": {"minimum": "medium", "maximum": "critical"},
  "forbidden_expected_phrases": ["synthetic forbidden phrase"],
  "fixed_only_fingerprints": [
    {
      "digest": "sha256:aaaaaaaaaaaaaaaaaaaaaaaaaaaaaaaaaaaaaaaaaaaaaaaaaaaaaaaaaaaaaaaa",
      "source_path": "src/example.py",
      "source_record_id": "synthetic-record"
    }
  ],
  "provenance": {"excerpt": "Synthetic provenance", "source_record_id": "synthetic-record"},
  "curator_notes": "Synthetic fixture only",
  "adjudication": {
    "required": true,
    "accepted_alternative_matches": ["Synthetic equivalent mechanism"]
  }
}
