{
  "schema_version": "1.0",
  "case_id": "synthetic-case",
  "expected_behavior": {
    "vulnerable": "Synthetic vulnerable behavior",
    "fixed": "Synthetic fixed behavior"
  },
  "expected_mechanisms": [
    {
      "mechanism_id": "mechanism-synthetic",
      "description": "Synthetic expected mechanism",
      "adjudication_rubric": "Match only the synthetic mechanism"
    }
  ],
  "acceptable_locations": [{"path": "src/example.py"}],
  "accepted_defect_categories": ["correctness"],
  "severity_range": {"minimum": "medium", "maximum": "high"},
  "forbidden_expected_phrases": [],
  "fixed_only_fingerprints": [],
  "provenance": {"excerpt": "Synthetic provenance", "source_record_id": "synthetic-record"},
  "curator_notes": "",
  "adjudication": {"required": false, "accepted_alternative_matches": []}
}
